{
  "format": "datapass.authority-snapshot",
  "contractVersion": "0.1-draft",
  "id": "authority-snapshot-example",
  "projectRef": "sample-retail",
  "scopeRef": "analytics",
  "base": {
    "scopeRevision": "draft-1",
    "manifestHash": {
      "algorithm": "sha256",
      "value": "761b83212a13d9cea140970f1628b4a3d212a60a2c4ae4f3177d9f0fba31afeb"
    },
    "repositories": [
      {
        "repoRef": "main",
        "revision": "fixture-revision",
        "workingTreeHash": {
          "algorithm": "sha256",
          "value": "761b83212a13d9cea140970f1628b4a3d212a60a2c4ae4f3177d9f0fba31afeb"
        }
      }
    ]
  },
  "classification": "internal",
  "createdAt": "2026-09-24T00:00:00Z",
  "sources": [
    {
      "id": "source-1",
      "authority": "synthetic-example",
      "recordRef": "fixture-only",
      "revision": "1",
      "observedAt": "2026-09-24T00:00:00Z",
      "classification": "internal",
      "snapshotHash": {
        "algorithm": "sha256",
        "value": "761b83212a13d9cea140970f1628b4a3d212a60a2c4ae4f3177d9f0fba31afeb"
      }
    }
  ],
  "payload": {
    "querySpecRef": "studies-summary",
    "querySpecHash": {
      "algorithm": "sha256",
      "value": "761b83212a13d9cea140970f1628b4a3d212a60a2c4ae4f3177d9f0fba31afeb"
    },
    "asOf": "2026-09-24T00:00:00Z",
    "state": "partial",
    "recordRefs": [
      "study-1"
    ],
    "omissions": [
      "full documents excluded"
    ],
    "nextCursorAvailable": false,
    "encoding": "mongodb-canonical-ejson",
    "dataArtifactRef": "snapshot-1"
  }
}
